id_akd,date,title,description,sifat_rapat,id_jenis_agenda,id_masa_persidangan,tempat,status,id
Komisi VIII,2025-04-28 13:00:00,"RDP Komisi VIII DPR RI dengan Para Kepala Kanwil Kemenag Provinsi Embarkasi Haji Indonesia dan Dirut PT. Garuda Indonesia, serta RDPU dengan Dirut PT. Lion Air dan Dirut PT. Saudi Airlines","1.) Pembahasan Persiapan Penyelenggaraan Ibadah Haji Tahun 1446 H/ 2025M;
2.) Isu-isu Aktual",Terbuka,Rapat Dengar Pendapat,120.0,Ruang Rapat Komisi VIII DPR RI,Terjadwal,22921
Komisi IX,2025-04-28 13:00:00,"Rapat Kerja Komisi IX DPR RI:
1. Menteri Pelindungan Pekerja Migran Indonesia/BP2MI
2. Sekjen Kementerian Ketenagakerjaan RI
3. Atase Ketenagakerjaan di Arab Saudi","1. Membahas rencana pencabutan moratorium penempatan Pekerja Migran Indonesia (PMI) di Arab Saudi.
2. Membahas implementasi tata kelola pelindungan yang komprehensif
bagi Pekerja Migran Indonesia (PMI) sebelum keberangkatan, selama
bekerja dan kepulangan ke tanah air.
3. Membahas penguatan peran Atase Ketenagakerjaan (Atnaker) dalam
hal pengawasan dan perlindungan serta integrasi data Pekerja Migran
Indonesia (PMI) di Arab Saudi.
4. Membahas mekanisme pemberian bantuan hukum dan perlindungan
bagi Pekerja Migran Indonesia (PMI) dari eksploitasi dan kekerasan.
5. Evaluasi penanganan PMI yang menjadi korban TPPO khususnya di
negara Kamboja, Myanmar dan Laos",Terbuka,Rapat Kerja,120.0,Ruang Rapat Komisi IX DPR RI,Terjadwal,22920
Komisi II,2025-04-28 10:00:00,Raker dan RDP Komisi II DPR RI dengan Menteri Dalam Negeri RI dan Para Gubernur ,"-	Membahas terkait Penyelenggaraan Pemerintah Daerah;
-	Membahas terkait dana transfer pusat ke daerah; 
-	Membahas terkait Badan Usaha Milik Daerah (BUMD) dan Badan
Layanan Umum Daerah (BLUD); dan
-	Membahas terkait pengelolaan kepegawaian.
",Terbuka,Rapat Kerja,120.0,Ruang Rapat Komisi II DPR RI ,Terjadwal,22919
Badan Kehormatan,2025-03-17 13:48:00,Rapat Pleno Badan Legislasi DPR RI Dalam Rangka Pengambilan Keputusan atas Hasil Penyusunan Rancangan Undang-Undang tentang Perubahan Ketiga atas Undang-Undang Nomor 18 Tahun 2017 tentang Pelindungan Pekerja Migran Indonesia,Pengambilan Keputusan atas Hasil Penyusunan Rancangan Undang-Undang tentang Perubahan Ketiga atas Undang-Undang Nomor 18 Tahun 2017 tentang Pelindungan Pekerja Migran Indonesia,Terbuka,Workshop / Bimtek,116.0,"Ruang Rapat Baleg DPR RI, Gedung Nusantara I Lt. 1, Jalan Jenderal Gatot Soebroto, Jakarta 10270",Terjadwal,22918
Komisi XI,2025-04-24 13:00:00,Rapat Internal Komisi XI,Pembahasan Jadwal Komisi XI DPR RI,Rahasia,Rapat Gabungan,120.0,"Ruang Rapat Komisi XI DPR RI, Gedung Nusantara I",Terjadwal,22917
Komisi VII,2025-04-24 10:00:00,"Rapat Dengar Pendapat Panja RUU tentang Kepariwisataan Komisi VII DPR RI 
Kamis, 24 April 2025",Pembahasan DIM RUU Kepariwisataan,Tertutup,Rapat Dengar Pendapat,120.0,Hotel Le Meridien,Terjadwal,22916
Badan Kehormatan,2025-03-03 13:36:00,"Pleno Harmonisasi Rangka Harmonisasi 10 RUU tentang Kabupaten/Kota di Provinsi Gorontalo, Sulawesi Tenggara, dan Sulawesi Utara","Keterangan Pengusul (Komisi II DPR RI) Dalam Rangka Harmonisasi 10 RUU tentang Kabupaten/Kota di Provinsi Gorontalo, Sulawesi Tenggara, dan Sulawesi Utara",Terbuka,Workshop / Bimtek,116.0,"Ruang Rapat Baleg DPR RI, Gedung Nusantara I Lt. 1, Jalan Jenderal Gatot Soebroto, Jakarta 10270",Terjadwal,22915
Komisi II,2025-04-24 13:00:00,"Raker dan RDP Komisi II DPR RI Dengan Menteri Dalam Negeri; dan Dirjen Keuangan Daerah Kementerian Dalam Negeri RI.
","- Penjelasan terkait BUMD, BLUD, dan Barang Milik Negara; dan
- Pengawasan Dana Transfer Pusat ke Daerah.",Terbuka,Rapat Kerja,120.0,Ruang Rapat Komisi II DPR RI ,Terjadwal,22914
Komisi II,2025-04-24 10:00:00,RDP Komisi II DPR RI dengan Dirjen Otonomi Daerah Kemendagri,Pembahasan terkait RPP ttg Penataan Daerah & RPP tentang Desain Besar Penataan Daerah.,Terbuka,Rapat Dengar Pendapat,120.0,Ruang Rapat Komisi II DPR RI ,Terjadwal,22913
Komisi II,,RDP Komisi II DPR RI dengan Dirjen Otonomi Daerah Kemendagri,Pembahasan terkait RPP ttg Penataan Daerah & RPP tentang Desain Besar Penataan Daerah.,Terbuka,Rapat Dengar Pendapat,120.0,Ruang Rapat Komisi II DPR RI ,Dibatalkan,22912
Komisi II,,RDP Komisi II DPR RI dengan Dirjen Otonomi Daerah Kemendagri,Pembahasan terkait RPP ttgPenataan Daerah & RPP tentang Desain Besar Penataan Daerah.,Terbuka,Rapat Dengar Pendapat,120.0,Ruang Rapat Komisi II DPR RI ,Dibatalkan,22911
Komisi II,,RDP Komisi II DPR RI dengan Dirjen Otonomi Daerah Kemendagri,Pembahasan terkait Rancanga Peraturan Pemerintah tentang Penataan Daerah dan Rancangan Peraturan Pemerintah tentang Desain Besar Penataan Daerah.,Terbuka,Rapat Dengar Pendapat,120.0,Ruang Rapat Komisi II DPR RI ,Terjadwal,22910
Komisi II,,RDP Komisi II DPR RI dengan Dirjen Otonomi Daerah Kementerian Dalam Negeri RI.,Pembahasan terkait Rancanga Peraturan Pemerintah tentang Penataan Daerah dan Rancangan Peraturan Pemerintah tentang Desain Besar Penataan Daerah.,Terbuka,Rapat Dengar Pendapat,120.0,Ruang Rapat Komisi II DPR RI ,Terjadwal,22909
Komisi X,2025-04-24 10:00:00,Rapat Dengar Pendapat Komisi X DPR RI dengan Kepala Perpustakaan Nasional RI,"1. Progres Pelaksanaan Program Kerja dan Dukungan Anggaran Perpusnas RI TA 2025.
2. Lain-lain.",Rahasia,Rapat Dengar Pendapat,120.0,Ruang Rapat Komisi X DPR RI,Terjadwal,22908
,2025-04-17 13:00:00,Rapat Internal Komisi XII DPR RI,"1.	Menetapkan Jadwal Acara Rapat Komisi XII DPR RI Masa Persidangan III Tahun Sidang 2024-2025;
2.	Menetapkan Daerah Tujuan Kunker Reses Masa Persidangan III Tahun Sidang 2024-2025, yaitu:
a.	Provinsi Jambi (Petrochina International Jabung Ltd, dll);
b.	Provinsi Kalimantan Timur (PT MSJ, PT Berau Coal Tbk, dll)
c.	Provinsi Kalimantan Selatan (Perusahaan Pertambangan Batubara PT Adaro Energy)
3.	Lain-lain.
",Tertutup,Rapat Gabungan,120.0,Ruang Rapat Komisi XII DPR RI,Terjadwal,22907
Komisi VI,2025-04-24 14:13:00,"RDPU Panja Penyusunan Naskah Akademik dan RUU tentang Perlindungan Konsumen Komisi VI DPR RI dengan:
1. Dirjen Perlindungan Konsumen dan Tertib Niaga Kementerian Perdaganagan RI
2. Ketua Umum Asosiasi Perusahaan Jasa Pengiriman Ekspres Indonesia",1. ,Terbuka,Kunjungan Kerja,120.0,Ruang Rapat Komisi VI DPR RI,Terjadwal,22906
,2025-04-22 10:40:00,Rapat Audiensi Komisi XII DPR RI dengan Panitia Khusus DPRD Provinsi Jambi,Konsultasi terkait Participating Interest (PI) 10% Migas di Wilayah Provinsi Jambi,Terbuka,Rapat Internal,120.0,Ruang Rapat Komisi XII DPR RI,Terjadwal,22905
,2025-04-23 15:17:00,Rapat Dengar Pendapat Komisi XII DPR RI dengan Dirjen Ketenagalistrikan KESDM RI dan Dirut PT PLN (Persero),"1.	Penjelasan kesesuaian RUKN dan RUPTL
2.	Lain-lain
",Tertutup,Rapat Dengar Pendapat,120.0,Ruang Rapat Komisi XII DPR RI,Terjadwal,22904
Badan Kehormatan,2025-04-24 13:00:00,BADAN LEGISLASI DPR RI (Pleno) RDP dalam rangka penyusunan RUU tentang Perubahan UU No.16 Tahun 1997 tentang Statistik ,"RDP dengan :
1. Kementerian Sosial (Dirjen Pemberdayaan Sosial)
2. Badan Perencanaan Pembangunan Nasional (Direktur Perencanaan Makro Analisis Statistik)
3. Kementerian Perindustrian (Kepala Pusat Data dan Informasi)",Terbuka,Rapat Dengar Pendapat,120.0,Ruang Rapat Badan Legislasi,Terjadwal,22903
Badan Kehormatan,2025-04-24 10:00:00,BADAN LEGISLASI DPR RI RDPU dalam rangka penyusunan RUU tentang Perubahan UU No.16 Tahun 1997 tentang Statistik ,"RDPU dengan :
1. PT Pupuk Indonesia
2. PT Pertamina
3. PT PLN
4. Perum Bulog
",Terbuka,Kunjungan Kerja,120.0,Ruang Rapat Badan Legislasi,Terjadwal,22902
,2025-04-23 13:37:00,"Rapat Dengar Pendapat Umum/ Audiensi dengan Kuasa Hukum Mantan Karyawan Oriental Circus Indonesia (OCl), Komisi Nasional HAM, Komisi Nasional Perempuan, dan Dirjen Kementerian HAM RI ",RDPU/Audiensi terkait pengaduan pelanggaran HAM terhadap Eks karyawan OCl,Terbuka,Kunjungan Kerja,120.0,"Ruang Rapat Komisi XIII, Pansus B",Terjadwal,22901
Komisi IX,2025-04-24 13:00:00,Rapat Internal Panja Pengawasan Komisi IX DPR RI mengenai Pelindungan Tenaga Kerja Migran ,Penyusunan program kerja dan kegiatan Panja,Tertutup,Seminar / Diskusi,120.0,Ruang Rapat Komisi IX DPR RI,Terjadwal,22900
Komisi IX,2025-04-24 12:00:00,RDPU / Audiensi Komisi IX DPR RI dengan DPRD Kab. Cirebon,Konsultasi Problematika Universal Health Coverage BPJS di Kab. Cirebon,Terbuka,Kunjungan Kerja,120.0,Ruang Rapat Komisi IX DPR RI,Terjadwal,22899
Komisi IX,2025-04-24 10:00:00,RDPU / Audiensi Komisi IX DPR RI dengan Fakultas Kesehatan Masyarakat Universitas Indonesia,Usulan Perbaikan Regulasi dan Implementasi Program Kesehatan,Terbuka,Kunjungan Kerja,120.0,Ruang Rapat Komisi IX DPR RI,Terjadwal,22898
Badan Legislasi,2022-09-26 10:30:00,Rapat Pimpinan DPR RI,Membahas Surat-surat Masuk dan lain-lain,Tertutup,Kegiatan Eksternal,83.0,"Ruang Rapat Pansus B, Gedung Nusantara II Lantai 3",Terjadwal,22897
Komisi VII,2025-04-23 10:00:00,"Rapat Dengar Pendapat Panja RUU tentang Kepariwisataan Komisi VII DPR RI
Rabu, 23 April 2025",Pembahasan DIM RUU Kepariwisataan,Tertutup,Rapat Dengar Pendapat,120.0,Hotel Le Meridien,Terjadwal,22896
Komisi VI,2025-04-24 11:01:00,RDP Komisi VI DPR RI dengan Kepala Badan Keahlian DPR RI,Progres report NA dan RUU tentang Perlindungan Konsumen serta masukan substansi Komisi VI DPR RI.,Terbuka,Rapat Dengar Pendapat,120.0,Ruang rapat Komisi VI DPR RI,Terjadwal,22895
Komisi VI,2025-04-23 10:39:00,"RDP Komisi VI DPR RI dengan: 
1. Direktur Utama Perum Jasa Tirta I beserta subholding. 
2. Direktur Utama Perum Jasa Tirta II beserta subholding, ","1. Perkenalan mitra kerja Komisi VI DPR RI;
2. Evaluasi kinerja korporasi Tahun 2024
3. Penyampaian rencana kerja dan roadmap korporasi Tahun 
2025; dan
4. Lain-Lain.",Terbuka,Rapat Dengar Pendapat,120.0,Ruang rapat Komisi VI DPR RI,Terjadwal,22894
Komisi VII,2025-04-24 14:00:00,Rapat Dengar Pendapat Umum Komisi VII DPR RI dengan YLBHI LBH Yogyakarta dan Komunitas UMKM DIY,Menerima Audiensi dengan YLBHI LBH Yogyakarta dan Komunitas UMKM DIY,Terbuka,Kunjungan Kerja,120.0,Ruang Rapat Komisi VII DPR RI,Terjadwal,22893
Komisi VII,2025-04-22 14:00:00,Rapat Dengar Pendapat Panja RUU tentang Kepariwisataan Komisi VII DPR RI,Pembahasan DIM RUU Kepariwisataan,Tertutup,Rapat Dengar Pendapat,120.0,Hotel Le Meridien,Terjadwal,22892
Komisi X,2025-04-23 16:00:00,"Rapat Kerja Komisi X DPR RI dengan Menteri Pendidikan Tinggi, Sains, dan Teknologi RI","1. Progres Pelaksanaan Program Kerja dan Dukungan Anggaran Kemdiktisaintek TA 2025.
2. Lain-lain.",Terbuka,Rapat Kerja,120.0,Ruang Rapat Komisi X DPR RI,Terjadwal,22891
Komisi X,2025-04-23 13:30:00,Rapat Kerja Komisi X DPR RI dengan Menteri Pemuda dan Olahraga RI,"1. Progres Pelaksanaan Program Kerja dan Dukungan Anggaran Kemenpora TA 2025;
2. Lain - lain.",Terbuka,Rapat Kerja,120.0,Ruang Rapat Komisi X DPR RI,Terjadwal,22890
Komisi X,2025-04-23 10:00:00,Rapat Kerja Komisi X DPR RI dengan Menteri Kebudayaan RI,"1. Progres Pelaksanaan Program Kerja dan Dukungan Anggaran Kementerian Kebudayaan TA 2025;
2. Lain - lain.",Terbuka,Rapat Kerja,120.0,Ruang Rapat Komisi X DPR RI,Terjadwal,22889
Komisi V,2025-04-24 13:00:00,Raker Komisi V DPR RI dengan Menteri Perhubungan,"1. Membahas Program Kerja APBN TA 2025 (Pagu sebelum dan setelah efesiensi)
2. Membahas Hasil Pemeriksaan BPK RI Semester I Tahun 2024,
3. dan lain-lain.",Terbuka,Rapat Kerja,120.0,Ruang Rapat Komisi V DPR RI (KK.V),Dibatalkan,22888
Komisi V,2025-04-23 10:00:00,"Raker RDP Komisi V DPR RI dengan Menteri Pekerjaan Umum, Menteri Perhubungan, Kepala BMKG dan Kepala BNPP/Basarnas",Membahas evaluasi pelaksanaan Infrastruktur & Transportasi pada arus mudik & arus balik Lebaran Tahun 2025,Terbuka,Rapat Kerja,120.0,Ruang Rapat Komisi V DPR RI (KK.V),Terjadwal,22887
,2025-04-23 10:00:00,"Badan Aspirasi Masyarakat DPR RI RDPU dengan Dewan Presidium Pusat Koalisi Ojol Nasional
",Mendengarkan Aspirasi dari Koalisi Ojol Nasional terkait ketidakjelasan Status Pekerjaaan dan Hubungan Kerja Kemitraan dengan Pihak Perusahaan Aplikator,Terbuka,Kunjungan Kerja,120.0,Ruang Rapat BAM DPR RI Gedung Nusantara II lantai 2 ,Terjadwal,22886
Badan Kehormatan,2025-04-23 13:00:00,"BADAN LEGISLASI DPR RI RDP dengan :
1. Kementerian Komunikasi dan Digital (Dirjen Pengawasan Ruang Digital)
2. Kementerian Perdagangan (Dirjen Perdagangan Dalam Negeri)
dalam rangka penyusunan RUU tentang Perubahan UU No.16 Tahun 1997 tentang Statistik ","RDP dengan :
1. Kementerian Komunikasi dan Digital (Dirjen Pengawasan Ruang Digital)
2. Kementerian Perdagangan (Dirjen Perdagangan Dalam Negeri)
dalam rangka penyusunan RUU tentang Perubahan UU No.16 Tahun 1997 tentang Statistik ",Terbuka,Rapat Dengar Pendapat,120.0,Ruang Rapat Badan Legislasi,Terjadwal,22885
Komisi IX,2025-04-23 13:30:00,Rapat Internal Panja RUU tentang Perubahan Ketiga atas Undang-Undang Nomor 13 Tahun 2003 tentang Ketenagakerjaan  ,Penyusunan program kerja dan kegiatan Panja,Tertutup,Seminar / Diskusi,120.0,Ruang Rapat Komisi IX DPR RI,Terjadwal,22884
Komisi IX,2025-04-23 11:00:00,Rapat Internal Panja Pengawasan Komisi IX DPR RI mengenai Percepatan Eliminasi Tuberculosis,Penyusunan program kerja dan kegiatan Panja,Tertutup,Seminar / Diskusi,120.0,Ruang Rapat Komisi IX DPR RI,Terjadwal,22883
Komisi IX,2025-04-23 10:00:00,Rapat Internal Panja Pengawasan Komisi IX DPR RI mengenai Jaminan Kesehatan Nasional ,Penyusunan program kerja dan kegiatan Panja,Tertutup,Seminar / Diskusi,120.0,Ruang Rapat Komisi IX DPR RI,Terjadwal,22882
Komisi II,2025-04-23 10:00:00,"RDP Komisi II DPR RI dengan Ketua ORI; Kepala ANRI; dan Kepala LAN RI
",Membahas Program Kerja Tahun 2025,Terbuka,Rapat Dengar Pendapat,120.0,Ruang Rapat Komisi II DPR RI ,Terjadwal,22881
Komisi IV,2025-04-22 13:00:00,Rapat Internal Komisi IV DPR RI (Tertutup),"1. Penetapan Pimpinan & Anggota Panja Penyusunan Rancangan Undang-Undang tentang Perubahan Ketiga atas Undang-Undang Nomor 18 Tahun 2012 tentang Pangan; 
2. Penetapan Pimpinan & Anggota Panja Penyusunan Rancangan Undang-Undang tentang Perubahan Keempat atas Undang-Undang Nomor 41 Tahun 1999 tentang Kehutanan;
3. Penetapan Pimpinan & Anggota Panja Pengawasan Distribusi Pupuk Bersubsidi; dan 
4. Penetapan Pimpinan & Anggota Panja Pengawasan Penyerapan Gabah.
",Tertutup,Rapat Gabungan,120.0,Ruang Rapat Komisi IV DPR RI (KK IV),Terjadwal,22880
Komisi IX,2025-04-22 12:00:00,Rapat Internal,Pembahasan dan Penetapan Program Kerja Komisi IX DPR RI pada Masa Persidangan III Tahun Sidang 2024-2025.,Tertutup,Rapat Gabungan,120.0,Ruang Rapat Komisi IX DPR RI,Terjadwal,22879
Komisi IV,2025-04-22 10:00:00,Komisi IV DPR RI Rapat Kerja dengan Menteri Kelautan dan Perikanan ,Efisiensi Anggaran (Blokir) Kementerian Kelautan dan Perikanan Tahun Anggaran 2025,Terbuka,Rapat Kerja,120.0,Ruang Rapat Komisi IV DPR RI (KK IV) ,Terjadwal,22878
Komisi X,2025-04-22 14:00:00,Rapat Kerja (Raker) Komisi X DPR RI dengan Menteri Pendidikan Dasar dan Menengah RI;,-,Tertutup,Rapat Kerja,120.0,Ruang Rapat Komisi X DPR RI,Terjadwal,22877
Komisi X,2025-04-22 10:00:00,Rapat Intern Komisi X DPR RI,-,Tertutup,Rapat Anggaran,120.0,Ruang Rapat Komisi X DPR RI,Terjadwal,22876
Komisi VII,2025-04-21 14:00:00,Rapat Kerja Komisi VII DPR RI dengan Pemerintah,Melanjutkan Rapat Kerja Komisi VII DPR RI dengan Pemerintah Dalam Rangka Penyampaian Hasil Konsolidasi DIM Pemerintah Terhadap RUU tentang Kepariwisataan,Terbuka,Rapat Kerja,120.0,Ruang Rapat Komisi VII,Terjadwal,22875
Komisi II,2025-04-22 10:00:00,Raker & RDP Komisi II DPR RI dengan Menteri PAN RB RI dll,"1. Membahas Kebijakan Penempatan ASN ke Ibu Kota Nusantara;
2. Membahas terkait digitalisasi Pemerintah Desa ;
3. Dan Lain-lain.
",Terbuka,Rapat Kerja,120.0,Ruang Rapat Komisi II DPR RI ,Terjadwal,22874
Badan Kehormatan,2025-04-22 13:00:00,"BADAN LEGISLASI DPR RI (Pleno) Rapat Dengar Pendapat Dengan : 
1. Kepala Badan Pusat Statistik
2. Kementerian Dalam Negeri (Dirjen Dukcapil)
dalam rangka penyusunan RUU tentang Perubahan UU No.16 Tahun 1997 tentang Statistik 
","BADAN LEGISLASI DPR RI (Pleno) Rapat Dengar Pendapat Umum Dengan : 1. Kepala Badan Pusat Statistik
  2. Kementerian Dalam Negeri (Dirjen Dukcapil)
dalam rangka penyusunan RUU tentang Perubahan UU No.16 Tahun 1997 tentang Statistik ",Terbuka,Rapat Dengar Pendapat,120.0,Ruang Rapat Badan Legislasi,Terjadwal,22873
Komisi VII,2025-04-21 10:00:00,Rapat Internal Panja Komisi VII DPR RI dengan Wakil Menteri dan Sekretaris Menteri Pariwisata RI,Penyampaian Pokok-Pokok Perubahan Daftar Inventarisasi Masalah (DIM) dalam RUU Kepariwisataan,Tertutup,Rapat Gabungan,120.0,Ruang Rapat Komisi VII,Terjadwal,22872
,2025-04-17 13:40:00,Rapat Intern Komisi XIII DPR RI,Pembahasan Jadwal Kegiatan Rapat dan Kunjungan Kerja Komisi XIII DPR RI Masa Sidang III Tahun Sidang 2024-2025.,Tertutup,Rapat Gabungan,120.0,"Ruang Rapat Komisi XIII, Gedung Nusantara II DPR RI, Lantai 3 Jl. Jenderal Gatot Subroto, Jakarta Pusat",Terjadwal,22871
Komisi IV,2025-04-21 10:00:00,Komisi IV DPR RI menerima Audensi Komisi B DPRD Kabupaten Magetan,Koordinasi/konsultasi terkait Program Pemerintah Pusat di Bidang Pertanian untuk Kabupaten Magetan di TA. 2025 ,Terbuka,Rapat Internal,120.0,Ruang Rapat Komisi IV DPR RI (KK IV),Terjadwal,22870
Badan Kehormatan,2025-04-21 13:00:00,"BADAN LEGISLASI DPR RI (PLENO) RDPU dengan narasumber :
1. E-Commerce (Shopee & Tokopedia)
2. Operator Seluler (Telkomsel, Indosat& XL)
dalam rangka penyusunan RUU tentang Perubahan UU No.16 Tahun 1997 tentang Statistik 
","(Pleno) RDPU dengan narasumber :
1. E-Commerce (Shopee & Tokopedia)
2. Operator Seluler (Telkomsel, Indosat& XL)
dalam rangka penyusunan RUU tentang Perubahan UU No.16 Tahun 1997 tentang Statistik 
",Terbuka,Kunjungan Kerja,120.0,Ruang Rapat Badan Legislasi,Terjadwal,22869
Komisi III,2025-04-21 14:00:00,"Komisi III DPR RI: Rapat Dengar Pendapat dan Rapat Dengar Pendapat Umum dengan Dirreskrimum Polda Jabar, Mantan Pemain Sirkus Oriental Circus Indonesia (OCI) dan Kuasa Hukum serta Pengelola Sirkus Taman Safari",Dugaan adanya penganiayaan terhadap mantan pemain Oriental Circus Indonesia (OCI) di Taman Safari,Terbuka,Kunjungan Kerja,120.0,Ruang Rapat Komisi III DPR RI,Terjadwal,22868
Komisi XI,2025-04-21 16:00:00,"Rapat Internal Komisi XI DPR RI

",Pembahasan Jadwal Kegiatan Komisi XI DPR RI.,Rahasia,Rapat Gabungan,120.0,"Ruang Rapat Komisi XI DPR RI, Gedung Nusantara I",Terjadwal,22867
Komisi VII,2025-04-17 13:00:00,Rapat Intern Komisi VII DPR RI,Pembahasan Program Kerja Komisi VII DPR RI,Tertutup,Rapat Gabungan,120.0,Ruang Rapat Komisi VII DPR RI,Terjadwal,22866
Badan Legislasi,2022-12-12 14:00:00,Rapat Pimpinan DPR RI ,Membahas surat-surat masuk dan lain-lain,Tertutup,Kegiatan Eksternal,85.0,"Ruang Rapat Pansus B, Gedung Nusantara II Lantai 3",Terjadwal,22865
Badan Legislasi,2022-11-16 10:00:00,Rapat Pimpinan DPR RI ,Membahas Surat-surat masuk dan lain-lain.,Tertutup,Kegiatan Eksternal,85.0,"Ruang Rapat Pansus B, Gedung Nusantara II Lantai 3",Terjadwal,22864
Badan Legislasi,2022-11-09 10:30:00,Rapat Pimpinan DPR RI ,Membahas surat-surat masuk dan lain-lain.,Tertutup,Kegiatan Eksternal,85.0,"Ruang Rapat Pansus B, Gedung Nusantara II Lantai 3",Terjadwal,22863
Komisi VIII,2025-04-17 14:00:00,"Rapat Kerja Komisi VIII DPR RI dengan Kepala Badan Penyelenggara Haji RI, serta Rapat Dengar Pendapat dengan Sekjen Kemenag RI, Dirjen PHU Kemenag RI, Dirut PT. Garuda Indonesia, dan Dirut PT. Lion Air ","1. Pembahasan Persiapan Pengawasan Penyelenggaraan Ibadah Haji Tahun 1446 H/ 2025 M;
2. Isu-isu Aktual.",Tertutup,Rapat Kerja,120.0,Ruang Rapat Komisi VIII DPR RI,Terjadwal,22862
Badan Kehormatan,2025-04-17 13:00:00,Badan Legislasi (Rapat Pleno) ,Penetapan Jadwal Acara rapat-rapat Badan Legislasi Masa Persidangan III Tahun Sidang 2024-2025,Terbuka,Workshop / Bimtek,120.0,Ruang Rapat Badan Legislasi,Terjadwal,22861
,2025-04-17 10:00:00,Rapat Paripurna DPR RI Ke-17 Pembukaan Masa Persidangan III Tahun Sidang 2024-2025,Pidato Ketua DPR RI Pembukaan Masa Persidangan III Tahun Sidang 2024-2025,Terbuka,Rapat Tertutup,120.0,Ruang Rapat Paripurna Gedung Nusantara 2 Lantai 3 ,Terjadwal,22860
Badan Kehormatan,2025-02-04 13:33:00,RDPU dalam rangka Penyusunan RUU tentang Perubahan Ketiga atas UU No 18 Tahun 2017 tentang Perlindungan Pekerja Migran Indonesia,Penyusunan RUU tentang Perubahan Ketiga atas UU No. 18 Tahun 2017 tentang Pelindungan Pekerja Migran Indonesia,Terbuka,Kunjungan Kerja,116.0,"Ruang Rapat Baleg DPR RI, Gedung Nusantara I Lt. 1, Jalan Jenderal Gatot Soebroto, Jakarta 10270",Terjadwal,22859
Badan Legislasi,2022-09-28 10:00:00,Rapat Koordinasi Pimpinan DPR RI dengan Pimpinan Komisi I S.D. XI,Membicarakan Rencana Kunjungan Kerja Komisi I s.d. XI DPR RI pada Reses Masa Persidangan I Tahun Sidang 2022—2023 ,Tertutup,Rapat Penyusunan,83.0,Ruang Rapat Pansus B Gd. Nusantara II Lantai 3,Terjadwal,22858
Badan Legislasi,2022-08-24 13:00:00,Rapat Pimpinan DPR RI,Membahas surat-surat masuk dan lain-lain,Tertutup,Kegiatan Eksternal,98.0,Ruang Rapat Pansus B Gd. Nusantara II Lantai 3,Terjadwal,22857
Badan Legislasi,2022-06-29 12:30:00,Rapat Koordinasi Pimpinan DPR RI dengan Pimpinan Komisi I S.D. XI,Membicarakan Rencana Kunjungan Kerja Komisi I s.d Komisi XI DPR RI MS. V TS. 2021-2022,Tertutup,Rapat Penyusunan,95.0,Ruang Rapat Pansus B Gd. Nusantara II Lantai 3,Terjadwal,22856
Badan Legislasi,2022-06-09 10:30:00,Rapat Pimpinan DPR RI,Membicarakan surat-surat masuk dan lain-lain,Tertutup,Kegiatan Eksternal,81.0,Ruang Rapat Pansus B Gd. Nusantara II Lantai 3,Terjadwal,22855
Badan Legislasi,2022-04-13 10:00:00,"Pertemuan Konsultasi Pimpinan DPR RI, Pimpinan Fraksi-Fraksi, Pimpinan AKD DPR RI dengan Kementerian Luar Negeri",Membicarakan Pemberian Pertimbangan Calon Duta Besar Luar Biasa dan Berkuasa Penuh (LBBP) Negara Sahabat untuk Republik Indonesia,Terbuka,Evaluasi Program,83.0,Ruang Rapat Pansus B Gd. Nusantara II Lantai 3,Terjadwal,22854
Badan Legislasi,2022-03-28 11:00:00,Rapat Pimpinan DPR RI,"1.	Membicarakan surat-surat masuk;
2.	Lain-lain
",Tertutup,Kegiatan Eksternal,79.0,Ruang Rapat Pansus B Gd. Nusantara II Lantai 3,Terjadwal,22853
Badan Legislasi,2022-02-03 10:00:00,Rapat Pimpinan DPR RI,Rapat Pimpinan DPR RI membahas tentang surat-surat masuk,Tertutup,Kegiatan Eksternal,79.0,Ruang Rapat Pansus B Gd. Nusantara II Lantai 3,Terjadwal,22852
Badan Legislasi,2022-01-19 10:00:00,"Pertemuan Konsultasi Pimpinan DPR RI, Pimpinan Fraksi-Fraksi, Pimpinan AKD DPR RI dengan Kementerian Luar Negeri",Membicarakan Pemberian Pertimbangan Calon Duta Besar Luar Biasa dan Berkuasa Penuh (LBBP) Negara Sahabat untuk Republik Indonesia,Tertutup,Evaluasi Program,77.0,Ruang Rapat Pansus B Gd. Nusantara II Lantai 3,Terjadwal,22851
Badan Legislasi,2022-01-13 14:00:00,Rapat Pimpinan DPR RI,"Membicarakan surat-surat masuk, dll",Tertutup,Kegiatan Eksternal,77.0,Ruang Rapat Pansus B Gd. Nusantara II Lantai 3,Terjadwal,22850
Badan Legislasi,2023-04-02 13:00:00,Rapat Koordinasi Pimpinan DPR RI dengan Pimpinan Komisi I S.D. XI,Rapat Koordinasi antara Pimpinan DPR R I dengan Pimpinan Komisi I s.d Komisi XI DPR R I mengenai Kunjungan Kerja Masa Sidang III Tahun Sidang 2022-2023 ,Tertutup,Rapat Penyusunan,87.0,Ruang Rapat Pansus B Gd. Nusantara II Lantai 3,Terjadwal,22849
Badan Legislasi,2023-04-07 10:30:00,Rapat Pimpinan DPR RI,"1.	Membahas Surat-surat Masuk
2.	Lain-lain
",Tertutup,Kegiatan Eksternal,87.0,Ruang Rapat Pansus B Gd. Nusantara II Lantai 3,Terjadwal,22848
Badan Legislasi,2023-02-09 10:00:00,"Pertemuan Konsultasi Pimpinan DPR RI, Pimpinan Fraksi-Fraksi, Pimpinan AKD DPR RI dengan Kementerian Luar Negeri","Membicarakan Pemberian Pertimbangan Calon Duta
Besar Luar Biasa dan Berkuasa Penuh (LBBP) Negara
Sahabat untuk Republik Indonesia
",Tertutup,Evaluasi Program,87.0,Ruang Rapat Pansus B Gd. Nusantara II Lantai 3,Terjadwal,22847
Badan Legislasi,2023-03-14 12:30:00,Rapat Pimpinan DPR RI,"1.	Membahas Surat-surat Masuk, dan;
2.	Lain-lain
",Tertutup,Kegiatan Eksternal,85.0,Ruang Rapat Pansus B Gd. Nusantara II Lantai 3,Terjadwal,22846
Badan Legislasi,2023-04-03 14:00:00,Rapat Pimpinan DPR RI,"1.	Membahas Surat-surat Masuk
2.	Lain-lain
",Tertutup,Kegiatan Eksternal,104.0,Ruang Rapat Pansus B Gd. Nusantara II Lantai 3,Terjadwal,22845
Badan Legislasi,2023-04-11 12:00:00,Rapat Koordinasi Kunker,Membahas mengenai Rencana Kunjungan Kerja Masa Reses Masa Persidangan IV Tahun Sidang 2022-2023,Tertutup,Rapat Penyusunan,104.0,Ruang Rapat Pansus B Gd. Nusantara II Lantai 3,Terjadwal,22844
Badan Legislasi,2023-04-11 13:00:00,"Pertemuan Konsultasi Pimpinan DPR RI, Pimpinan Fraksi-Fraksi, Pimpinan AKD DPR RI dengan Kementerian Luar Negeri",Pertemuan Konsultasi Pimpinan DPR R I dengan Kemenlu R I membahas Konsultasi Calon Duta Besar,Tertutup,Evaluasi Program,104.0,Ruang Rapat Pansus B Gd. Nusantara II Lantai 3,Terjadwal,22843
Badan Legislasi,2023-04-12 10:00:00,Rapat Pimpinan DPR RI,"1.	Membahas Surat-surat Masuk, dan;
2.	Lain-lain
",Tertutup,Kegiatan Eksternal,104.0,Ruang Rapat Pansus B Gd. Nusantara II Lantai 3,Terjadwal,22842
Badan Legislasi,2023-08-21 13:00:00,Rapat Konsultasi Pimpinan DPR RI ,Menyusun Laporan Kinerja DPR RI Tahun Sidang 2022-2023,Tertutup,Evaluasi Program,110.0,Ruang Rapat Pansus B Gd. Nusantara II Lantai 3,Terjadwal,22841
Badan Legislasi,2023-08-22 13:00:00,"Rapat Koordinasi Pimpinan DPR RI Dengan Pimpinan Komisi III, Komisi VII dan Komisi XI DPR RI",Pembahasan Temuan Data Ekspor Illegal Bijih (Ore) Nikel Ke China,Tertutup,Rapat Penyusunan,98.0,Ruang Rapat Pansus B Gd. Nusantara II Lantai 3,Terjadwal,22840
Badan Legislasi,2023-11-23 11:00:00,Rapat Koordinasi Pimpinan DPR RI dengan Pimpinan Komisi I S.D. XI,Rapat Koordinasi Kunjungan Kerja Komisi I s.d Komisi XI pada Masa Reses Masa Persidangan II Tahun Sidang 2023-2024,Tertutup,Rapat Penyusunan,100.0,Ruang Rapat Pansus B Gd. Nusantara II Lantai 3,Terjadwal,22839
Badan Legislasi,2023-11-23 11:00:00,"Pertemuan Konsultasi Pimpinan DPR RI, Pimpinan Fraksi-Fraksi, Pimpinan AKD DPR RI dengan Kementerian Luar Negeri",Pertemuan Konsultasi membahas Calon-calon Duta Besar Negara Sahabat ,Tertutup,Studi Banding,114.0,Ruang Rapat Pansus B Gd. Nusantara II Lantai 3,Terjadwal,22838
