id_akd,date,title,description,sifat_rapat,id_jenis_agenda,id_masa_persidangan,tempat,status,id
,2025-05-06 15:00:00,RDP dan RDPU Panja Minerba dengan Dirjen Minerba Kementerian ESDM RI dan Direktur Utama PT Mahakam Sumber Jaya,"1. Praktik pertambangan berkelanjutan 
2. Lain-lain ",Tertutup,Seminar / Diskusi,120.0,Ruang Rapat Komisi XII DPR RI,Terjadwal,23000
Komisi IX,2025-05-07 13:00:00,"Rapat Panja Pengawasan Komisi IX DPR RI mengenai Jaminan Kesehatan Nasional dengan Kemenkes RI, Kemendagri, Kemensos, Kepala BPS, BPJS Kesehatan, ADINKES, APEKSI, dan APKASI",Kepesertaan dan Kepatuhan Iuran,Terbuka,Seminar / Diskusi,120.0,Ruang Rapat Komisi IX DPR RI,Terjadwal,22999
Komisi IX,2025-05-07 10:00:00,"Rapat Panja Pengawasan Komisi IX DPR RI mengenai Percepatan Eliminasi Tuberculosis dengan Kemenkes RI, Kemenkeu, Kementerian Pekerjaan Umum RI, dan Kementerian PPN/Bappenas.","1. Kebijakan Program Percepatan Eliminasi Tuberculosis.
2. Anggaran Program Penanggulangan Tuberculosis.
3. Roadmap Percepatan Program Eliminasi Tuberculosis hingga 2030.",Terbuka,Rapat Dengar Pendapat,120.0,Ruang Rapat Komisi IX DPR RI,Terjadwal,22998
,2025-05-06 13:00:00,Rapat Dengar Pendapat Komisi XII DPR RI dengan Dirjen Mineral dan Batubara Kementerian ESDM RI,"1.	Strategi dalam menjaga stabilitas harga komoditas mineral dan batubara di dalam negeri
2.	Penjelasan terkait kebijakan Devisa Hasil Eksport (DHE) dan Kenaikan Royalti
3.	Perkembangan hilirisasi batubara
4.	Lain-lain
",Terbuka,Rapat Dengar Pendapat,120.0,Ruang Rapat Komisi XII DPR RI,Terjadwal,22997
Komisi X,2025-05-06 12:00:00,"RDP/RDPU Panja RUU tentang Sisdiknas Komisi X DPR RI dengan: 1.Dirjen PAUD, Pendidikan Dasar, dan Pendidikan Menengah 2. Dirjen Pendidikan Vokasi, Pendidikan Khusus, dan Pendidikan Layanan Khusus 3. Ketua HIMPAUDI 4. Prof. Dr. Budiyanto (Guru Besar Unesa)","1. Evaluasi pelaksanaan serta isu-isu strategis dalam Pendidikan Anak Usia Dini (PAUD).
2. Evaluasi pelaksanaan serta isu-isu strategis dalam Pendidikan Non-Formal, Pendidikan Informal, Pendidikan Khusus, dan Pendidikan Layanan Khusus.
3. Masukan terkait pengaturan penerapan wajib belajar pendidikan 13 tahun.
4. Masukan dan Rekomendasi dalam RUU tentang Sisdiknas.",Terbuka,Seminar / Diskusi,120.0,Ruang Rapat Komisi X DPR RI,Terjadwal,22996
Komisi XI,2025-05-07 14:00:00,RDP Komisi XI dengan Dirjen Bea Cukai tentang Penerimaan Bea dan Cukai,Penerimaan Bea dan Cukai,Rahasia,Rapat Dengar Pendapat,120.0,"Ruang Rapat Komisi XI DPR RI, Gedung Nusantara I",Terjadwal,22995
Komisi XI,2025-05-07 10:00:00,RDP Komisi XI dengan Dirjen Pajak tentang Penerimaan Pajak dan Coretax.,Penerimaan Pajak dan Coretax.,Rahasia,Rapat Dengar Pendapat,120.0,"Ruang Rapat Komisi XI DPR RI, Gedung Nusantara I",Terjadwal,22994
,2025-05-07 13:00:00,"Badan Aspirasi Masyarakat (BAM) DPR RI RDPU dengan Forum Komunikasi Pensiunan Indofarma (FKPI)
",Mendengarkan Aspirasi dari Forum Komunikasi Pensiunan Indofarma (FKPI) terkait Penyelesaian Permasalahan di Indofarma,Terbuka,Kunjungan Kerja,120.0,Ruang Rapat BAM DPR RI Gedung Nusantara II lantai 2 ,Terjadwal,22993
,2025-05-07 10:00:00,"Badan Aspirasi Masyarakat (BAM) DPR RI RDPU dengan Ikatan Dokter Anak Indonesia (IDAI)
",Mendengarkan Aspirasi dari Ikatan Dokter Anak Indonesia (IDAI) terkait Ancaman terhadap Independensi Profesi Dokter Anak,Terbuka,Kunjungan Kerja,120.0,Ruang Rapat BAM DPR RI Gedung Nusantara II lantai 2 ,Terjadwal,22992
Komisi IV,2025-05-06 13:00:00,RDP Panitia Kerja Penyusunan RUU tentang Perubahan Ketiga atas Undang-Undang Nomor 18 Tahun 2012 tentang Pangan dengan Pemerintah,meminta masukan terkait dengan Penyusunan RUU tentang Perubahan Ketiga atas Undang-Undang Nomor 18 Tahun 2012 tentang Pangan,Terbuka,Rapat Dengar Pendapat,120.0,Ruang Rapat Komisi IV DPR RI ,Terjadwal,22991
Komisi IV,2025-05-06 10:00:00,"Rapat Dengar Pendapat Umum Panitia Kerja Pengawasan Penyerapan Gabah dan Jagung dengan Penggilingan Padi dan Pengusaha Beras, Kontak Tani Nelayan Andalan, Asosisasi Pedagang dan Produsen Jagung Indonesia, Presidium Perhimpunan Sarjana Pertanian Indonesia","Menerima aspirasi, masukan dan sarana terhadap kebijakan penyerapan gabah dan jagung",Terbuka,Kunjungan Kerja,120.0,Ruang Rapat Komisi IV DPR RI ,Terjadwal,22990
Komisi VIII,2025-05-06 13:00:00,Rapat Internal Pimpinan Komisi VIII DPR RI dengan Sekretaris Jenderal DPR RI dan PT. Nur Ramadhan,Persiapan Tim Pengawas Haji DPR RI Tahun 1446 H/2025 M,Tertutup,Rapat Gabungan,120.0,Ruang Rapat Komisi VIII DPR RI,Terjadwal,22989
Komisi VIII,2025-05-06 10:00:00,Rapat Internal Pimpinan Komisi VIII DPR RI dengan Kapoksi VIII DPR RI  ,Pembahasan Program Kerja Mitra Komisi VIII DPR RI,Tertutup,Rapat Gabungan,120.0,Ruang Rapat Komisi VIII DPR RI,Terjadwal,22988
Komisi IX,2025-05-06 10:00:00,"Rapat Dengar Pendapat Komisi IX DPR RI dengan Kepala Badan Gizi
Nasional
","1. Membahas evaluasi capaian implementasi Program Makan
Bergizi Gratis hingga triwulan II tahun 2025
2. Membahas tantangan koordinasi Badan Gizi Nasional dengan berbagai pihak terkait, termasuk pemerintah daerah.",Terbuka,Rapat Dengar Pendapat,120.0,Ruang Rapat Komisi IX DPR RI ,Terjadwal,22987
Komisi I,2025-03-12 13:00:00,RDP Dengan Kepala Bakamla RI,Pekembangan Pembahasan Anggaran Passca Efisiensi ,Tertutup,Rapat Dengar Pendapat,116.0,Ruang Rapat Komisi I,Terjadwal,22986
Komisi V,2025-05-08 10:00:00,Raker Komisi V DPR RI dengan Menteri Perhubungan,"1. Membahas Program Kerja APBN TA 2025 (Pagu sebelum dan setelah efisiensi)
2. Membahas Hasil Pemeriksaan BPK RI Semester I Tahun 2024
3. dan lain-lain",Terbuka,Rapat Kerja,120.0,Ruang Rapat Komisi V DPR RI (KK-V),Terjadwal,22985
Komisi V,2025-05-07 10:00:00,Raker Komisi V DPR RI dengan Menteri Pekerjaan Umum,"1. Membahas Program Kerja APBN TA 2025 (Pagu sebelum dan setelah efisiensi)
2. Membahas Hasil Pemeriksaan BPK RI Semester I Tahun 2024
3. dan lain-lain",Terbuka,Rapat Kerja,120.0,Ruang Rapat Komisi V DPR RI (KK-V),Terjadwal,22984
Komisi V,2025-05-06 13:00:00,RDP Komisi V DPR RI dengan Kepala BMKG dan Kepala BNPP/BASARNAS ,"1. Membahas Program Kerja APBN TA 2025 (Pagu sebelum dan setelah efisiensi)
2. Membahas Hasil Pemeriksaan BPK RI Semester I Tahun 2024
3. dan lain-lain",Terbuka,Rapat Dengar Pendapat,120.0,Ruang Rapat Komisi V DPR RI (KK-V),Terjadwal,22983
,2025-05-05 13:00:00,"Rapat Dengar Pendapat Komisi XII DPR RI dengan Direktur Utama PT Bukit Asam, Tbk","1.	Perkembangan hilirisasi Batubara
2.	Lain-lain
",Terbuka,Rapat Dengar Pendapat,120.0,Ruang Rapat Komisi XII DPR RI,Terjadwal,22982
,2025-05-06 15:00:00,RDPU dengan Akademisi ,RDP dengan Prof. Ir. Sakti Adji Adisasmita dan Dr. Wahyudi Hasbi,Terbuka,Kunjungan Kerja,120.0,"Ruang Rapat Komisi XIII, Gd. Nusantara II Lantai 3",Terjadwal,22981
,2025-05-05 15:00:00,RDP dengan Sekjen Kemenhan dan Sekjen Kemenhub,RDP,Terbuka,Rapat Dengar Pendapat,120.0,"Ruang Rapat Komisi XIII, Gd. Nusantara II Lantai 3",Terjadwal,22980
,2025-05-05 11:00:00,Rapat Audiensi Komisi XII DPR RI dengan Institute for Essential Services Reform (IESR),Membahas Strategi pengembangan energi terbarukan serta perkembangan informasi tentang pengembangan RUU Energi Baru dan Energi Terbarukan,Terbuka,Rapat Internal,120.0,Ruang Rapat Komisi XII DPR RI,Terjadwal,22979
Komisi XI,2025-05-05 14:00:00,Rapat Kerja dengan Gubernur Bank Indonesia,Pembahasan penyertaan Modal Bank Indonesia dalam Nexus dan DAPENBI,Rahasia,Rapat Kerja,120.0,"Ruang Rapat Komisi XI DPR RI, Gedung Nusantara I",Terjadwal,22978
Komisi XI,,Rapat Kerja Komisi XI dengan Gubernur Bank Indonesia,Pembahasan Kinerja Bank Indonesia,Rahasia,Rapat Kerja,120.0,Ruang rapat Komisi XI ,Terjadwal,22977
Komisi XI,,Rapat Kerja Komisi XI dengan Gubernur Bank Indonesia,Pembahasan Kinerja Bank Indonesia,Rahasia,Rapat Kerja,120.0,Ruang rapat Komisi XI ,Terjadwal,22976
Komisi XI,2025-05-05 10:00:00,Rapat Kerja Komisi XI dengan Gubernur Bank Indonesia,Pembahasan Kinerja Bank Indonesia,Rahasia,Rapat Kerja,120.0,Ruang rapat Komisi XI ,Terjadwal,22975
Komisi X,2025-05-05 10:00:00,"Rapat Dengar Pendapat Umum (RDPU) Panja Pendidikan di Daerah 3T dan Daerah Marginal Komisi X DPR RI dengan Kuanta Indonesia, Jaringan Pemantau Pendidikan Indonesia (JPPI), dan UNICEF Indonesia.","1. Kontribusi organisasi masyarakat dan perguruan tinggi dalam peningkatan akses dan kualitas pendidikan di daerah;
2. Program dan strategi untuk meningkatkan minat anak-anak di daerah terpencil agar tetap bersekolah.
",Terbuka,Seminar / Diskusi,120.0,Ruang Rapat Komisi X DPR RI,Terjadwal,22974
Komisi VIII,2025-05-05 13:00:00,"Rapat Internal Panja Komisi VIII DPR RI mengenai RUU Perubahan atas UU No. 8 Tahun 2019 tentang Penyelenggaraan Ibadah Haji dan Umrah, dan Panja Komisi VIII DPR RI mengenai RUU Perubahan atas UU No. 34 Tahun 2014 tentang Pengelolaan Keuangan Haji.","1. Evaluasi Draft RUU Berdasarkan Hasil Kunjungan Kerja Panja PIHU ke Negara Kazakhstan;
2. Sinkronisasi RUU Perubahan Atas UU No. 8 Tahun 2019 tentang Penyelenggaraan Ibadah Haji dan Umrah, dan RUU Perubahan Atas UU No. 34 Tahun 2014 tentang Pengelolaan Keuangan Haji.",Tertutup,Rapat Gabungan,120.0,Ruang Rapat Komisi VIII DPR RI,Terjadwal,22973
Badan Kehormatan,2025-03-19 10:45:00,Rapat Pleno Penyusunan Rancangan Undang-Undang tentang Perubahan Undang-Undang Nomor 25 Tahun 1992 tentang Perkoperasian,Presentasi Tim Ahli atas Penyusunan Rancangan Undang-Undang tentang Perubahan Undang-Undang Nomor 25 Tahun 1992 tentang Perkoperasian,Terbuka,Workshop / Bimtek,116.0,"Ruang Rapat Baleg DPR RI, Gedung Nusantara I Lt. 1, Jalan Jenderal Gatot Soebroto, Jakarta 10270",Terjadwal,22972
Komisi IX,2025-05-05 13:00:00,Rapat Kerja Komisi IX dengan Menteri Ketenagakerjaan RI,"1. Membahas kesiapan menyelenggarakan program Rencana Tenaga Kerja (RTK) Mikro di 18 Provinsi serta target capaian yang akan dihasilkan.
2. Membahas implementasi skema school to work transition bekerja
sama dengan K/L untuk menekan angka pengangguran di Indonesia
3. Membahas evaluasi permasalahan Pemutusan Hubungan Kerja (PHK) sektor industri padat karya pemerintah atau swasta.
4. Membahas Program dan Anggaran
Pinjaman Hibah Luar Negeri (PHLN)
terkait Pengembangan BLK
Kemaritiman dan Labor Market
Information and Skills System
Transformation for Labor Market
Flexibility Project (LISTRAF) Tahun
2025.",Terbuka,Rapat Kerja,120.0,Ruang Rapat Komisi IX DPR RI,Terjadwal,22971
,2025-04-30 15:11:00,RDPU dengan Akademisi,RDPU dengan Akademisi,Terbuka,Kunjungan Kerja,120.0,Ruang Rapat BAKN,Terjadwal,22970
,2025-04-30 14:00:00,"RDP dan RDPU Komisi XII dengan Dirjen Minerba KESDM RI, Dirut PT Antam Tbk, Dirut PT Borneo Alumina Indonesia, Dirut PT Bintan Alumina Indonesia, Dirut PT WHW Alumina Refinery dan Asosiasi P3BAI","1.	Kapasitas produksi dan kapasitas smelter 
2.	Dampak kebijakan pelarangan eksport bijih 
3.	Harga patokan mineral 
4.	Lain-lain
",Terbuka,Rapat Dengar Pendapat,120.0,Ruang Rapat Komisi XII DPR RI,Terjadwal,22969
,2025-04-30 10:00:00,"RDP dan RDPU dengan Sekjen DEN, Dirjen EBTKE KESDM RI, Plt Kepala BAPETEN, Kepala BRIN, Dirut PT INUKI, dan Ketua HIMNI","1.	Rencana Pengembangan Pembangkit Listrik Tenaga Nuklir di Indonesia;
2.	Lain-lain.
",Terbuka,Rapat Dengar Pendapat,120.0,Ruang Rapat Komisi XII DPR RI,Terjadwal,22968
,2025-03-12 11:00:00,Rapat Internal Pansus RUU tentang Pengelolaan Ruang Udara,"1.Pemilihan dan Penetapan Pimpinan Pansus RUU tentang Pengelolaan Ruang Udara;
2.Brainstorming tentang Pembahasan RUU tentang Pengelolaan Ruang Udara.",Tertutup,Rapat Gabungan,116.0,Ruang Rapat Badan Legislasi,Terjadwal,22967
,2025-03-12 11:00:00,Rapat Intern Pansus RUU tentang Pengelolaan Ruang Udara,Pemilihan dan Penetapan Pimpinan Panitia Khusus RUU tentang Pengelolaan Ruang Udara,Tertutup,Public Hearing,116.0,Ruang Rapat Badan Legislasi,Dibatalkan,22966
,2025-04-30 10:00:00,RDPU Komisi XIII DPR RI dengan: (1) LBH APIK (2) HUMA (3) ELSAM,Masukan terhadap RUU tentang Perubahan Kedua atas Undang-Undang Nomor 13 Tahun 2008 tentang Perlindungan Saksi dan Korban,Terbuka,Kunjungan Kerja,120.0,Ruang Rapat Komisi XIII,Terjadwal,22965
Komisi IV,2025-04-30 10:00:00,Rapat Internal Panitia Kerja Pengawasan Distribusi Pupuk Bersubsidi,(Tertutup),Tertutup,Seminar / Diskusi,120.0,Ruang Rapat Komisi IV DPR RI (KK IV),Terjadwal,22964
Komisi IV,2025-04-29 13:00:00,Rapat Internal Panitia Kerja Penyusunan RUU tentang Perubahan Ketiga atas Undang-Undang Nomor 18 Tahun 2012 tentang Pangan,(TERTUTUP),Tertutup,Seminar / Diskusi,120.0,Ruang Rapat Komisi IV DPR RI (KK IV),Terjadwal,22963
Komisi IV,2025-04-29 10:00:00,Rapat Internal Panja Pengawasan Penyerapan Gabah dan Jagung ,(TERTUTUP),Tertutup,Seminar / Diskusi,120.0,Ruang Rapat Komisi IV DPR RI (KK IV),Terjadwal,22962
Komisi VIII,2025-04-30 10:00:00,Rapat Kerja Komisi VIII DPR RI dengan Menteri Sosial RI,"1. Pembahasan Penyelenggaraan Sekolah Rakyat dan Integrasi Data Tunggal Sosial Ekonomi Nasional (DTSEN);  
2. Isu-Isu aktual.",Terbuka,Rapat Kerja,120.0,Ruang Rapat Komisi VIII DPR RI,Terjadwal,22961
,2025-04-30 13:00:00,Rapat Dengar Pendapat Umum/Audiensi dengan Ketua Komisi Nasional Disabilitas Republik Indonesia,Audiensi,Terbuka,Kunjungan Kerja,120.0,Ruang Rapat Komisi XIII,Terjadwal,22960
Komisi II,2025-04-30 10:00:00,Raker dan RDP Komisi II DPR RI dengan Menteri Dalam Negeri RI dan Para Gubernur,"-	Membahas terkait Penyelenggaraan Pemerintah Daerah;
-	Membahas terkait dana transfer pusat ke daerah; 
-	Membahas terkait Badan Usaha Milik Daerah (BUMD) dan Badan Layanan Umum Daerah (BLUD); dan
-	Membahas terkait pengelolaan kepegawaian.
",Terbuka,Rapat Kerja,120.0,Ruang Rapat Komisi II DPR RI ,Terjadwal,22959
Komisi VII,2025-04-29 19:00:00,Rapat Dengar Pendapat Panja RUU tentang Kepariwisataan Komisi VII DPR RI dengan Pejabat Eselon I Pemerintah,Melanjutkan Pembahasan DIM RUU tentang Kepariwisataan ,Tertutup,Rapat Dengar Pendapat,120.0,Ruang Rapat Komisi VII,Terjadwal,22958
Komisi VII,2025-04-30 14:00:00,"Rapat Kerja Komisi VII DPR RI dengan Menteri Usaha Mikro, Kecil, dan Menengah RI",Membahas mengenai Evaluasi Pelaksanaan Penghapusan Piutang Macet kepada UMKM,Terbuka,Rapat Kerja,120.0,Ruang Rapat Komisi VII,Terjadwal,22957
Komisi VII,2025-04-30 10:00:00,Rapat Kerja Komisi VII DPR RI dengan Menteri Ekonomi Kreatif/Kepala Badan Ekonomi Kreatif RI,"Penyediaan Akses Pendanaan, Pembiayaan, dan Investasi Ekonomi Kreatif",Terbuka,Rapat Kerja,120.0,Ruang Rapat Komisi VII,Terjadwal,22956
Komisi IX,2025-04-28 11:00:00,Rapat Dengar Pendapat Umum Komisi IX DPR RI dengan DPRD Kabupaten Pemalang Provinsi Jawa Tengah,Menerima masukan,Terbuka,Kunjungan Kerja,120.0,Ruang Rapat Komisi IX DPR RI,Terjadwal,22955
Komisi IX,2025-04-30 13:30:00,"Rapat Kerja Komisi IX DPR RI dengan Menteri Kesehatan RI dan Menteri Pendidikan Tinggi, Sains dan Teknologi RI serta lembaga profesi terkait","1. Membahas permasalahan pelanggaran kode etik dan disiplin kedokteran di fasilitas pelayanan kesehatan
2. Membahas penguatan sistem pengaduan dan perlindungan korban di sektor kesehatan dan pendidikan
3. Membahas transformasi kebijakan penguatan profesionalisme tenaga medis",Terbuka,Rapat Kerja,120.0,Ruang Rapat Komisi IX DPR RI,Terjadwal,22954
Komisi IX,2025-04-30 10:00:00,Rapat Kerja Komisi IX DPR RI dengan Menteri Kependudukan dan Pembangunan Keluarga /BKKBN RI,"1. Membahas evaluasi strategi nasional percepatan penurunan stunting dan penguatan program keluarga berencana:
a. Capaian dan evaluasi program penurunan stunting, termasuk efektivitas Gerakan Genting di Triwulan II tahun 2025
b.Peninjauan kebijakan penempatan dan kesejahteraan tenaga PKB/PLKB.

2. Membahas strategi pengendalian kuantitas penduduk dan pencegahan pernikahan usia muda.",Terbuka,Rapat Kerja,120.0,Ruang Rapat Komisi IX DPR RI,Terjadwal,22953
Komisi VI,2025-04-29 14:56:00,RDP Komisi VI DPR RI Direktur Utama Perum Bulog.,"1. Evaluasi kinerja korporasi Tahun 2024;
2. Penyampaian rencana kerja dan roadmap korporasi Tahun 2025;
3. Progress report implementasi kebijakan Harga Pembelian Pemerintah (HPP) Gabah;
4. Strategi Mewujudkan Ketahanan Pangan Nasional; dan
5. Lain-Lain.",Terbuka,Rapat Dengar Pendapat,120.0,Ruang rapat Komisi VI DPR RI,Terjadwal,22952
Komisi VI,2025-04-29 11:08:00,RDP Komisi VI DPR RI Direktur Utama Perum Perhutan,"1. Perkenalan mitra kerja Komisi VI DPR RI;
2. Evaluasi kinerja korporasi Tahun 2024;
3. Penyampaian rencana kerja dan roadmap korporasi Tahun 2025; dan
4. Lain-Lain.
",Terbuka,Rapat Dengar Pendapat,120.0,Ruang rapat Komisi VI DPR RI,Terjadwal,22951
Komisi V,2025-04-30 13:00:00,Raker Komisi V DPR RI dengan Menteri Perumahan dan Kawasan Permukiman,Membahas Program Kerja APBN TA 2025 (pagu sebelum dan setelah efisiensi) dan membahas Hasil Pemeriksaan BPK RI Semester I Tahun 2024,Terbuka,Rapat Kerja,120.0,Ruang Rapat Komisi V DPR RI (KK.V),Terjadwal,22950
,2025-04-29 11:00:00,Rapat Intern Komisi XII dengan Badan Keahlian DPR RI,"1. Brainstorming Draft RUU EBET (RUU carry over)
2. Penjelasan penyusunan Draft RUU Ketenagalistrikan
3. Penjelasan penyusunan Draft RUU Migas",Tertutup,Rapat Gabungan,120.0,Ruang Rapat Komisi XII DPR RI,Terjadwal,22949
Komisi VII,2025-04-29 14:00:00,Rapat Kerja Komisi VII DPR RI dengan Menteri Perindustrian RI,"1. Implikasi Kebijakan Perdagangan Amerika Serikat terdahap Daya Saing Industri Nasional.
2. Arah Kebijakan dan Implementasi Insentif bagi pengembangan Sektor Industri Nasional",Terbuka,Rapat Kerja,120.0,Ruang Rapat Komisi VII,Terjadwal,22948
Komisi VII,2025-04-29 12:00:00,Rapat Dengar Pendapat Umum Komisi VII DPR RI dengan DPRD Kota Banjarbaru,Audiensi DPRD Kota Banjarbaru,Terbuka,Rapat Internal,120.0,Ruang Rapat Komisi VII,Terjadwal,22947
,2025-04-29 10:00:00,RAPAT DENGAR PENDAPAT KOMISI XIII DPR RI DENGAN ESELON I KEMENTERIAN IMIGRASI DAN PEMASYARAKATAN RI,"1.	Evaluasi Kinerja dan Realisasi Anggaran Tahun 2024;
2.	Program Kerja dan Anggaran Tahun 2025.",Terbuka,Rapat Dengar Pendapat,120.0,"Ruang Rapat Komisi XIII DPR RI, Nusantara 2 Lantai 3",Terjadwal,22946
,2025-04-28 15:14:00,Rapat Internal Pansus RUU Pengelolaan Ruang Udara,"1. Menyusun dan Mengesahkan Jadwal acara dan Mekanisme Pembahasan.
2. Lain-lain.",Tertutup,Rapat Gabungan,120.0,"Ruang Rapat Set Banggar, Gedung Nusantara II Lantai 2",Terjadwal,22945
Komisi V,2025-04-29 13:00:00,Komisi V DPR RI Rapat Kerja dengan Menteri Desa dan Pembangunan Daerah Tertinggal dan Menteri Transmigrasi,Membahas Program Kerja APBN TA 2025 (Pagu sebelum dan setelah efisiensi) dan membahas hasil pemeriksaan BPK RI Semester I tahun 2024,Terbuka,Rapat Kerja,120.0,Ruang Rapat Komisi V DPR RI (KK.V),Terjadwal,22944
Komisi VIII,2025-04-29 13:00:00,"Rapat Kerja Komisi VIII DPR RI dengan Kepala BPH RI, RDP dengan Dirjen PHU Kemenag RI, Para Kepala Kanwil Kemenag Provinsi Embarkasi Haji Indonesia, dan Dirut PT. Garuda Indonesia, serta RDPU dengan Dirut PT. Lion Air, Dirut PT. Saudi Airlines","1. Pembahasan Persiapan Penyelenggaraan Ibadah Haji Tahun 1446 H/ 2025 M;  
2. Isu-isu Aktual
",Rahasia,Rapat Kerja,120.0,Ruang Rapat Komisi VIII DPR RI,Terjadwal,22943
Komisi VII,2025-04-28 19:00:00,Rapat Dengar Pendapat Panja RUU tentang Kepariwisataan Komisi VII DPR RI dengan Pemerintah,Melanjutkan Pembahasan DIM RUU tentang Kepariwisataan,Tertutup,Rapat Dengar Pendapat,120.0,Ruang Rapat Komisi VII DPR RI,Terjadwal,22942
,2025-04-29 11:00:00,"Rapat Kerja Pansus RUU tentang Pengelolaan Udara dengan Menteri Pertahanan, Menteri Perhubungan, Menteri Hukum dan HAM, dan Pimpinan DPD RI","1.	Penjelasan Pemerintah mengenai RUU tentang Ruang Udara
2.	Pandangan Fraksi-fraksi DPR RI terhadap penjelasan Pemerintah
3.	Penyerahan DIM RUU tentang Pengelolaan Ruang Udara Carryover
",Terbuka,Rapat Kerja,120.0,Ruang Rapat Badan Legislasi ,Terjadwal,22941
Komisi VII,2025-04-28 14:00:00,Rapat Dengar Pendapat Komisi VII DPR RI dengan Badan Standardisasi Nasional RI,Membahas terkait Penguatan Standardisasi Nasional dalam menjawab tantangan perekonomian global,Terbuka,Rapat Dengar Pendapat,120.0,Ruang Rapat Komisi VII,Terjadwal,22940
Komisi IX,2025-04-29 10:00:00,Rapat Kerja Komisi IX DPR RI dengan Menteri Kesehatan RI,"1. Pembahasan isu-isu krusial di sektor kesehatan, Permasalahan Program Pendidikan Dokter Spesialis (PPDS) termasuk evaluasi sistem pendidikan pembiayaan, distribusi peserta didik, dan kejelasan status hubungan kerja.
2. Persiapan penyelenggaraan pelayanan kesehatan haji tahun 2025, mencakup kesiapan tenaga kesehatan, logistik obat dan alat kesehatan, serta koordinasi lintas sektor untuk menjamin pelayanan yang optimal bagi jamaah haji Indonesia",Terbuka,Rapat Kerja,120.0,Ruang Rapat Komisi IX DPR RI,Terjadwal,22939
,2025-04-28 15:00:00,Rapat Intern Pansus RUU tentang Pengelolaan Ruang Udara,Intern,Tertutup,Rapat Gabungan,120.0,Ruang Rapat Badan Anggaran DPR RI. Gd. Nusantara II Lt.2,Dibatalkan,22938
,2025-04-28 14:00:00,RDP Komisi XIII DPR RI dengan Pejabat Eselon I Kementerian HAM,"1. Evaluasi Kinerja dan Realisasi Anggaran Tahun 2024;
2. Program Kerja dan Anggaran Tahun 2025.",Terbuka,Rapat Dengar Pendapat,102.0,Ruang Rapat Komisi XIII DPR RI,Terjadwal,22937
Komisi IV,2025-04-28 13:00:00,Rapat Internal Panitia Kerja Penyusunan Rancangan Undang-Undang tentang Perubahan Keempat atas Undang-Undang Nomor 41 Tahun 1999 tentang Kehutanan,(RAPAT TERTUTUP),Tertutup,Rapat Gabungan,120.0,Ruang Rapat Komisi IV DPR RI (KK IV),Terjadwal,22936
Komisi IV,2025-04-28 11:00:00,Komisi IV DPR RI menerima Asosiasi Nelayan dan Pedagang Ikan (AMPD) Provinsi Gorontalo,Membahas Persoalan Nelayan di Provinsi Gorontalo,Tertutup,Rapat Internal,120.0,Ruang Rapat Komisi IV DPR RI (KK IV),Terjadwal,22935
Komisi IV,2025-04-28 09:00:00,Komisi IV DPR RI menerima Audensi Komisi B DPRD Kabupaten Bojonegoro,Membahas Serapan Gabah Petani Tahun 2025,Tertutup,Rapat Internal,120.0,Ruang Rapat Komisi IV DPR RI (KK IV),Terjadwal,22934
,2025-04-30 10:00:00,Badan Aspirasi Masyarakat (BAM) DPR RI RDPU dengan Perkumpulan Komunitas Peduli Konsumen Meikarta,Mendengarkan Aspirasi dari Perkumpulan Komunitas Peduli Konsumen Meikarta terkait Penyelesaian Permasalahan KPKM,Terbuka,Kunjungan Kerja,120.0,Ruang Rapat BAM DPR RI Gedung Nusantara II lantai 2 ,Terjadwal,22933
,2025-04-28 10:30:00,RAPAT DENGAR PENDAPAT KOMISI XIII DPR RI DENGAN KETUA LPSK,"1.	Evaluasi Kinerja dan Realisasi Anggaran Tahun 2024;
2.	Program Kerja dan Anggaran Tahun 2025.
",Tertutup,Rapat Dengar Pendapat,120.0,"Ruang Rapat Komisi XIII, Gedung Nusantara II DPR RI, Lantai 3 Jl. Jenderal Gatot Subroto, Jakarta Pusat",Terjadwal,22932
,2025-04-28 14:00:00,"Rapat Dengar Pendapat Komisi XII dengan Dirjen Migas Kementerian ESDM RI, Kepala SKK Migas, Dirut PT PLN (Persero), dan Dirut PT PGN Tbk","1. Ketersediaan pasokan gas untuk Pembangkit dan Industri Pupuk
2. Rencana Pembangunan infrastruktur LNG untuk penyedia tenaga listrik
3. Lain-lain",Terbuka,Rapat Dengar Pendapat,120.0,Ruang Rapat Komisi XII DPR RI,Terjadwal,22931
Komisi VII,2025-04-28 10:10:00,"Rapat Dengar Pendapat Umum Komisi VII DPR RI dengan Asosiasi Industri Tekstil, Industri Baja, Industri Agro dan Pangan, Industri Kesehatan, dan Industri Semen",Membahas dampak kebijakan insentif tarif dari Pemerintah Amerika Serikat,Terbuka,Kunjungan Kerja,120.0,Ruang Rapat Komisi VII,Terjadwal,22930
Komisi XI,2025-04-28 14:00:00,Raker Komisi XI dengan Ketua dan Anggota DK OJK ,Tindak Lanjut putusan pengadilan di sektor perbankan,Rahasia,Rapat Kerja,120.0,Ruang Rapat Komisi XI,Terjadwal,22929
,2025-04-28 11:00:00,Rapat Dengar Pendapat Panja Migas Komisi XII dengan Plt Dirjen Migas Kementerian ESDM RI dan Kepala SKK Migas,"1.	Mekanisme dan ketentuan pengadaan di sektor hulu migas
2.	Lain-lain
",Tertutup,Seminar / Diskusi,120.0,Ruang Rapat Komisi XII DPR RI,Terjadwal,22928
Komisi X,2025-04-28 14:00:00,Rapat Dengar Pendapat Komisi X DPR RI dengan Kepala Badan Riset dan Inovasi Nasional,"1. Progres Pelaksanaan Program Kerja dan Dukungan Anggaran BRIN TA 2025;
2. Lain - lain.",Rahasia,Rapat Dengar Pendapat,120.0,Ruang Rapat Komisi X DPR RI,Dibatalkan,22927
Komisi X,2025-04-28 10:00:00,"Rapat Dengar Pendapat Komisi X DPR RI dengan Kepala Badan Pusat Statistik,","1. Progres Pelaksanaan Program Kerja dan Dukungan Anggaran BPS TA 2025;
2. Lain - lain.",Tertutup,Rapat Dengar Pendapat,120.0,Ruang Rapat Komisi X DPR RI,Terjadwal,22926
Komisi VI,2025-04-28 14:16:00,RDPU Komisi VI DPR RI dengan Perwakilan Paguyuban Karyawan PT Kertas Leces (Persero),Audiensi terkait Permohonan Advokasi karyawan PT Kertas Leces untuk mendapatkan hak – hak normatif berupa gaji terhutang dan pesangon terhutang yang di bayar oleh manajemen PT Kertas Leces (Persero).,Terbuka,Kunjungan Kerja,120.0,Ruang rapat Komisi VI DPR RI,Terjadwal,22925
Komisi VI,2025-04-28 10:19:00,"RDPU Komisi VI DPR RI dengan: 
1. Aliansi Masyarakat Rempang Galang Bersatu (AMAR-GB). 
2. Masyarakat Desa Gobah Kecamatan Tambang.","1. Audiensi terkait penolakan Masyarakat Adat Tempatan Pulau Rempang perihal keberadaan PSN Rempang Eco City yang akan menyingkirkan masyarakat dan menghilangkan identitas kultural Masyarakat Melayu. 
2. Audiensi terkait permohonan/bantuan pengembalian tanah ulayat yang dimanfaatkan PTPN Kebun Sei Pagar.",Terbuka,Kunjungan Kerja,120.0,Ruang rapat Komisi VI DPR RI,Terjadwal,22924
Komisi XI,2025-04-28 10:00:00,Rapat Kerja Komisi XI dengan Anggota DK OJK,"Rancangan POJK tentang Pemberian Kemudahan Akses Pembiayaan kepada Usaha Mikro, Kecil dan Menengah",Rahasia,Rapat Kerja,120.0,Ruang Rapat Komisi XI,Terjadwal,22923
Komisi II,2025-04-29 13:00:00,Raker dan RDP Komisi II DPR RI dengan Menteri Dalam Negeri RI dan Para Gubernur,"-	Membahas terkait Penyelenggaraan Pemerintah Daerah;
-	Membahas terkait dana transfer pusat ke daerah; 
-	Membahas terkait Badan Usaha Milik Daerah (BUMD) dan Badan Layanan Umum Daerah (BLUD); dan
-	Membahas terkait pengelolaan kepegawaian.
",Terbuka,Rapat Kerja,120.0,Ruang Rapat Komisi II DPR RI ,Terjadwal,22922
